{
  "$schema": "http://json-schema.org/draft-07/schema#",
  "$id": "https://gregorian-grimorium/schema/chant.schema.json",
  "title": "Chant",
  "type": "object",
  "additionalProperties": false,
  "required": [
    "id",
    "incipit",
    "title",
    "genre",
    "text_latin",
    "gabc",
    "provenance",
    "review_status"
  ],
  "properties": {
    "id": {
      "type": "string",
      "pattern": "^[a-z0-9]+(-[a-z0-9]+)*$",
      "description": "Slug único, derivado del íncipit y desambiguado con el id de origen."
    },
    "incipit": {
      "type": "string"
    },
    "title": {
      "type": "string"
    },
    "cantus_id": {
      "type": [
        "string",
        "null"
      ],
      "description": "Identificador en Cantus Index, cuando la fuente lo aporta. Permite cruzar la pieza con los catálogos de musicología."
    },
    "genre": {
      "type": "string",
      "enum": [
        "Introitus",
        "Graduale",
        "Alleluia",
        "Tractus",
        "Offertorium",
        "Communio",
        "Antiphona",
        "Responsorium",
        "Responsorium breve",
        "Hymnus",
        "Sequentia",
        "Kyriale",
        "Psalmus",
        "Canticum",
        "Oratio",
        "Preces",
        "Improperia",
        "Varia",
        "Other"
      ]
    },
    "genre_code": {
      "type": [
        "string",
        "null"
      ],
      "description": "Código de dos letras de la fuente (in, gr, al...), conservado para trazabilidad."
    },
    "mode": {
      "type": [
        "string",
        "null"
      ],
      "enum": [
        "I",
        "II",
        "III",
        "IV",
        "V",
        "VI",
        "VII",
        "VIII",
        null
      ]
    },
    "mode_variant": {
      "type": [
        "string",
        "null"
      ],
      "description": "Variante o modo irregular (peregrinus, etc.) tal como lo declara la fuente."
    },
    "version": {
      "type": [
        "string",
        "null"
      ],
      "description": "Versión melódica (p.ej. \"Solesmes\"), cuando la fuente la distingue."
    },
    "text_latin": {
      "type": "string",
      "description": "Texto latino extraído del gabc, sin la notación."
    },
    "gabc": {
      "type": "string",
      "description": "Notación en gabc. Es la partitura: el frontend la dibuja con Exsurge, en vez de reproducir la maquetación de una edición ajena."
    },
    "transcriber": {
      "type": [
        "string",
        "null"
      ]
    },
    "commentary": {
      "type": [
        "string",
        "null"
      ]
    },
    "liturgical_occurrences": {
      "type": "array",
      "items": {
        "type": "object",
        "additionalProperties": false,
        "required": [
          "calendar",
          "celebration"
        ],
        "properties": {
          "calendar": {
            "type": "string"
          },
          "celebration": {
            "type": "string"
          }
        }
      }
    },
    "bibliography": {
      "type": "array",
      "description": "Ediciones impresas donde aparece la pieza, con su página.",
      "items": {
        "type": "object",
        "additionalProperties": false,
        "required": [
          "title"
        ],
        "properties": {
          "title": {
            "type": "string"
          },
          "editor": {
            "type": [
              "string",
              "null"
            ]
          },
          "year": {
            "type": [
              "integer",
              "null"
            ]
          },
          "page": {
            "type": [
              "string",
              "null"
            ]
          }
        }
      }
    },
    "provenance": {
      "type": "object",
      "additionalProperties": false,
      "required": [
        "origin",
        "license"
      ],
      "properties": {
        "origin": {
          "type": "string",
          "enum": [
            "gregobase",
            "gabc-file",
            "public-domain-scan",
            "licensed"
          ]
        },
        "license": {
          "type": "string",
          "description": "Licencia del registro de origen (p.ej. CC0-1.0)."
        },
        "external_id": {
          "type": [
            "string",
            "null"
          ]
        },
        "snapshot": {
          "type": [
            "string",
            "null"
          ],
          "description": "Volcado o fecha concreta de la fuente, para poder reproducir la importación."
        }
      }
    },
    "review_status": {
      "type": "string",
      "enum": [
        "draft",
        "needs_review",
        "verified"
      ]
    },
    "repeat_indication": {
      "type": [
        "string",
        "null"
      ],
      "description": "Indicación de repetición de la fuente (\"ij\" = bis, \"iij\" = ter). Es una rúbrica de ejecución, no texto cantado."
    },
    "psalm_tone_ending": {
      "type": "boolean",
      "description": "La pieza termina con la fórmula salmódica, escrita \"E u o u a e\" (las vocales de saeculorum amen)."
    },
    "performance_notes": {
      "description": "Rúbricas que el libro imprime sobre el pentagrama y que no se cantan: «Hic genuflectitur», «Cantor», «Omnes». Salen de las etiquetas <alt> del gabc.",
      "type": "array",
      "items": {
        "type": "string",
        "minLength": 1
      }
    }
  }
}
