{
  "id": "sancte-paule-3891",
  "incipit": "Sancte Paule",
  "title": "Sancte Paule",
  "cantus_id": null,
  "genre": "Alleluia",
  "genre_code": "al",
  "mode": "VIII",
  "mode_variant": null,
  "version": "Vatican",
  "text_latin": "Allelúia. * ℣. Sancte Paule Apóstole, praedicátor veritátis, et doctor géntium, intercéde * pro nobis.",
  "repeat_indication": "ij",
  "psalm_tone_ending": false,
  "gabc": "(c4) AL(d)LE(ggf)LÚ(hg~)IA.(gv//efd) *(;) <i>ij.</i>(df!ghhg/jvIHG) (,) (giih/kvJIHGivHGFgh//fefd) (,) (df!ghhg/jvIHhg) <sp>V/</sp>.(::) San(dg~)cte(gh) Pau(gvFDe)le(ev//dec) (,) A(g!hi)pó(ih)sto(h/jkJHGFg)le,(g) (;) prae(g)di(e)cá(fe)tor(d) ve(d)ri(ef)tá(g)tis,(g/iih/kvJIHhg) (:) et(gk) do(kg)ctor(hf) gén(g!hi~)ti(ih!iw!jvIHG)um,(g/hfg) (;) in(d)ter(ggf~)cé(hg)de(g) *() pro(f) no(de)bis.(ev//dec) (;) (df!ghhg/jvIHG) (,) (giih/kvJIHGivHGFgh//fefd) (,) (df!ghhg/jvIHhg) (::)",
  "transcriber": "Andrew Hinkley",
  "commentary": null,
  "liturgical_occurrences": [],
  "bibliography": [
    {
      "title": "Graduale Romanum",
      "editor": "Vatican",
      "year": 1908,
      "page": "470"
    }
  ],
  "provenance": {
    "origin": "gregobase",
    "license": "CC0-1.0",
    "external_id": "3891",
    "snapshot": "gregobase_20191024"
  },
  "review_status": "needs_review"
}
