{
  "id": "emitte-spiritum-3459",
  "incipit": "Emitte Spiritum",
  "title": "Emitte Spiritum",
  "cantus_id": null,
  "genre": "Tractus",
  "genre_code": "tr",
  "mode": "II",
  "mode_variant": null,
  "version": "Vatican",
  "text_latin": "Emítte * Spíritum tuum, et creabúntur: et renovábis fáciem terrae. ℣. O quam bonus et suávis est, Dómine, Spíritus tuus in nobis! ℣. Veni Sancte Spíritus, reple tuórum corda fidélium: et tui amóris in eis ignem * accénde.",
  "repeat_indication": null,
  "psalm_tone_ending": false,
  "gabc": "(f3) E(c)MÍT(ef)TE(fd/efCBc) *(,) Spí(ef)ri(e)tum(fh) tu(hhhvGFg)um,(fe) (;) et(g!hi) cre(h)a(hhg)bún(fe~)tur:(ef/gf/ggf/gh/iffe) (:) et(e) re(gh)no(f)vá(fe/f!gwh!iv)bis(hg/hiih) (;) fá(ef)ci(eh)em(gh/ih) ter(hvGF)rae.(f/ggf) <sp>V/</sp>.(::) O(fe) quam(ef) bo(hh/ijhhg/ihhggf!gwhgh)nus(gf) (;) et(f!gwhg) su(h)á(f!gwhg)vis(h) est,(fi) (,) Dó(hi)mi(hvGF)ne,(fe/ggf/gh/iffe) (:) Spí(gh)ri(f)tus(f) tu(fe/f!gwh!iv)us(hg/hiih) (;) in(i) no(hvGF)bis!(fefEC//fef/ggf) <sp>V/</sp>.(::) <alt>Hic genuflectitur.</alt> Ve(kxhi/ji/jkIH//ji/jkIH,jjijvIH//jjijvIH//ji/jiif)ni(f) (;) Sanc(fe)te(h) Spí(h!ij)ri(jvIHGhvGFg)tus,(gf) (:) re(fc!dwe!fg)ple(f) tu(f)ó(f)rum(hg) cor(h)da(f) fi(i)dé(hhg)li(fe)um:(ef/gf/ggf/gh/iffe) (:) et(e) tu(gh)i(f) a(f)mó(fe/f!gwh!iv)ris(kxhgi//jkiih) (;) in(hi) e(h)is(hf) i(hihhe~)gnem(fgf) *() ac(g)cén(ihivHFg,hjijHGF)de.(fe/f!hh/ijIGh) (,) (gh!jvIHhvGFggf) (::)",
  "transcriber": "Andrew Hinkley",
  "commentary": null,
  "liturgical_occurrences": [],
  "bibliography": [
    {
      "title": "Graduale Romanum",
      "editor": "Vatican",
      "year": 1908,
      "page": "[73]"
    }
  ],
  "provenance": {
    "origin": "gregobase",
    "license": "CC0-1.0",
    "external_id": "3459",
    "snapshot": "gregobase_20191024"
  },
  "review_status": "needs_review",
  "performance_notes": [
    "Hic genuflectitur."
  ]
}
