{
  "id": "meditabar-5315",
  "incipit": "Meditabar...",
  "title": "Meditabar...",
  "cantus_id": null,
  "genre": "Offertorium",
  "genre_code": "of",
  "mode": "II",
  "mode_variant": null,
  "version": "Dominican",
  "text_latin": "Meditábar in mandátis tuis, quæ diléxi valde: et levávi manus meas ad mandáta tua, quæ diléxi. T. P. Allelúia.",
  "repeat_indication": null,
  "psalm_tone_ending": false,
  "gabc": "(f3) Me(e)di(f)tá(fhhegf)bar(f) (::) in(e) man(f)dá(hih)tis(hih) tu(hihhvGF)is,(gf) (;) quæ(hg) di(h)lé(hji)xi(hji) val(hg)de:(f) (:) et(e) le(f)vá(hhi)vi(h) (;4) ma(fh)nus(ef) me(fh)as(h) (;3) (ih//ihhvFEf) (;) ad(e) man(f)dá(hih)ta(hihi) tu(fgffe)a,(e) (:) quæ(hg) di(h)lé(hji/hhf;3dxihihhvFED;efED//efef)xi.(f) (;3) (hhvGF/gvgf) <i>T. P.</i>(::) Al(c)le(efef//ghg//hvGE;4f!ghGF)lú(fg/hgh)ia.(gf) (::)",
  "transcriber": "Andrew Hinkley",
  "commentary": null,
  "liturgical_occurrences": [],
  "bibliography": [
    {
      "title": "Graduale O.P. (Suarez)",
      "editor": "Dominican",
      "year": 1950,
      "page": "466"
    }
  ],
  "provenance": {
    "origin": "gregobase",
    "license": "CC0-1.0",
    "external_id": "5315",
    "snapshot": "gregobase_20191024"
  },
  "review_status": "needs_review"
}
