{
  "id": "confirma-hoc-sine-alleluia-83",
  "incipit": "Confirma hoc sine Alleluia",
  "title": "Confirma hoc sine Alleluia",
  "cantus_id": null,
  "genre": "Offertorium",
  "genre_code": "of",
  "mode": "IV",
  "mode_variant": null,
  "version": "Solesmes",
  "text_latin": "Confírma * hoc Deus, quod operátus es in nobis : a templo tuo, quod est in Jerúsalem, tibi ófferent reges múnera.",
  "gabc": "(c4) COn(d!ewf)fír(f)ma(e'!fg) *() hoc(ixghf___/ih/igh) De(e)us,(egf/gffe.) (;) quod(f) o(fgff)pe(df)rá(fff/ghg)tus(gef) es(e_d) (,) in(gh) no(g/jjj)bis :(hjhhg.) (:)\r\na(g) tem(gh)plo(h_g) tu(ixgih'ivGF')o,(gffe.) (;) quod(f_e/f_g) est(ixhig'hvF'E) (,) in(gh) Je(gjh)rú(ghf/ghg)sa(fd)lem,(ev./f!gfgd.) (:)\r\nti(df/gef)bi(f.) óf(ixf_e/hih'/ih)fe(hhgh)rent(g.) re(df/gef)ges(f.) (,) mú(fge___)ne(f/ghf)ra.(ff//egf/gffe.) (::)",
  "transcriber": "Jacques Peron",
  "commentary": null,
  "liturgical_occurrences": [],
  "bibliography": [
    {
      "title": "Graduale Romanum",
      "editor": "Solesmes",
      "year": 1961,
      "page": "[94]"
    }
  ],
  "provenance": {
    "origin": "gregobase",
    "license": "CC0-1.0",
    "external_id": "83",
    "snapshot": "gregobase_20191024"
  },
  "review_status": "needs_review"
}
