{
  "id": "qui-operatus-est-3500",
  "incipit": "Qui operatus est",
  "title": "Qui operatus est",
  "cantus_id": null,
  "genre": "Graduale",
  "genre_code": "gr",
  "mode": "V",
  "mode_variant": null,
  "version": "Vatican",
  "text_latin": "Qui operátus est * Petro in apostolátum, operátus est et mihi inter gentes: et cognovérunt grátiam Dei, quae data est mihi. ℣. Grátia Dei in me vácua non fuit: sed grátia ejus semper in me * manet.",
  "repeat_indication": null,
  "psalm_tone_ending": false,
  "gabc": "(c4) QUI(fgf) o(f)pe(gh)rá(ixhih)tus(g) est(fgff!ded) *(,) Pe(d!fg)tro(ghg/hvGF/gf) (;) in(f) a(gh)po(g)sto(fg)lá(f)tum,(fv//ff/gvDC/fg/hg/hvGF/gf) (:) o(fg)pe(h)rá(jj)tus(kjjvIH) est(jj) (,) et(jk) mi(jhk)hi(ixjkjj!hih) (,) in(ixhi)ter(hhg) gen(ixjh/ij)tes:(ih) (:) et(h) co(h)gno(j)vé(jik)runt(jkjj!hih) (,) grá(hg/h!iwj/kj)ti(ji/k!lwmk)am(k) De(jj/kj//lvKJ/jvIH)i,(ih) (;) quae(hg) da(h!ij)ta(hg) est(ixhi) mi(hf/hvGFg)hi.(f) (,) (ixhiGF/gwhg/hjhh!fgf) <sp>V/</sp>.(z0::c3) Grá(hh)ti(h)a(h) De(ih/ghf//hiHG//hiFD , f!hh/ih/ghf//hiHG//hiFD , gxfge!fwg/hf//hg/hvFD , fdfED//fd/ef!hhhf//hi!kkkJIHi)i(ih) (;) in(f) me(hi) vá(j)cu(ih)a(hihh/fgf) (,) non(f!hi//hhhfh) fu(fhf/hhhvGFEf)it:(eed) (:) sed(d) grá(efef/hih)ti(gxfgFE)a(e) e(gxhf/gh)jus(gf) (;) sem(d)per(ef) in(f) me(fhGF) *() ma(i)net.(hhf) (,) (gxgf/gvED//fgED//fe/hvhhhff/dfe/feed) (::)",
  "transcriber": "Andrew Hinkley",
  "commentary": null,
  "liturgical_occurrences": [],
  "bibliography": [
    {
      "title": "Graduale Romanum",
      "editor": "Vatican",
      "year": 1908,
      "page": "368"
    }
  ],
  "provenance": {
    "origin": "gregobase",
    "license": "CC0-1.0",
    "external_id": "3500",
    "snapshot": "gregobase_20191024"
  },
  "review_status": "needs_review"
}
