{
  "id": "dies-sanctificatus-1489",
  "incipit": "Dies sanctificatus",
  "title": "Dies sanctificatus",
  "cantus_id": null,
  "genre": "Alleluia",
  "genre_code": "al",
  "mode": "II",
  "mode_variant": null,
  "version": "Vatican",
  "text_latin": "Allelúia * ℣. Dies sanctificátus illúxit nobis: veníte gentes, et adoráte Dóminum: quia hódie descéndit lux magna * super terram.",
  "repeat_indication": "ij",
  "psalm_tone_ending": false,
  "gabc": "(f3) AL(e)LE(f)LÚ(hi~)IA(ih/iggf) *(,) <i>ij.</i>(hv/iji/ef/hfhv//ghe/hhhf!gwhf) <sp>V/</sp>.(::) Di(fe/f!gwh!iv//ji/ihi)es(iv//hh/fgf) sanc(fg~)ti(f)fi(f)cá(fg)tus(f) (,) il(f)lú(fg)xit(f) no(f!hh/ijHFivHGEf//hfh/hf/ge)bis:(e) (:) ve(ffe/ffe/fc,ef!hvhvFEhhh)ní(hi)te(h) gen(hi~)tes,(h) (,) et(h) a(h)do(h)rá(h)te(ivHGh) Dó(f)mi(fgf)num:(f) (:) qui(f)a(f) hó(f!hi)di(ji/ihi)e(iv//hh/fgf) (,) de(f)scén(fg~)dit(f) lux(f) ma(f!hh/ijHFivHGEf//hfh/hf/ge)gna(e) *(;) su(hh)per(hi~) ter(ih/jij)ram.(jvjvIHGE//f!gwhf) (::)",
  "transcriber": "Andrew Hinkley",
  "commentary": null,
  "liturgical_occurrences": [],
  "bibliography": [
    {
      "title": "Graduale Romanum",
      "editor": "Vatican",
      "year": 1908,
      "page": "31"
    }
  ],
  "provenance": {
    "origin": "gregobase",
    "license": "CC0-1.0",
    "external_id": "1489",
    "snapshot": "gregobase_20191024"
  },
  "review_status": "needs_review"
}
