{
  "id": "magnificat-immac-cord-b-m-v-5121",
  "incipit": "Magnificat (Immac. Cord. B. M. V.)",
  "title": "Magnificat (Immac. Cord. B. M. V.)",
  "cantus_id": null,
  "genre": "Alleluia",
  "genre_code": "al",
  "mode": "VI",
  "mode_variant": null,
  "version": "Dominican",
  "text_latin": "Allelúia. ℣. Magníficat ánima mea Dóminum: et exsultávit spíritus meus in Deo salutári meo.",
  "repeat_indication": null,
  "psalm_tone_ending": false,
  "gabc": "(c4) Al(d)le(ff)lú(ixfgf/ivHGh)ia.(hv//fgf//ivGF/hhf) (::) (dfe/gvFDdc//ffc) (;) (fhgj//jjj//kjjh) (;3) (fhg/hggf) <sp>V/</sp>.(::) Ma(ff)gní(f)fi(ixfgf/ivHGh)cat(hv//fgf//ivGF/hhf) (;) á(f!hj)ni(j)ma(jjvIG) me(ixg/jjj//kjjhi)a(ih) (;) Dó(f!gh/jhhgh//fgFD;cd/fd//cd!ff gh!ijIH)mi(ghf)num:(f!gh!ivHG/hih) (:) et(f) ex(fg)sul(f)tá(ixf!ghgh//jj//jvIHG//jj//jvIGF/hv;f!ghgh/jj//jvIHG//jj//jvIGF/hv//fgf/ih)vit(ghf) (;) spí(df)ri(f)tus(fgf) me(fv//efd)us(cf) (;) in(ff) De(ixfgf/ivHGh)o(hv//fgf//ivGF/hhf) (::) sa(dfe)lu(gf)tá(ddc)ri(ffc) (;1) me(ixfhgj//jjj//kjjhi)o.(hv//fhg/hggf) (::)",
  "transcriber": "Andrew Hinkley",
  "commentary": null,
  "liturgical_occurrences": [],
  "bibliography": [
    {
      "title": "Graduale O.P. (Suarez)",
      "editor": "Dominican",
      "year": 1950,
      "page": "557"
    }
  ],
  "provenance": {
    "origin": "gregobase",
    "license": "CC0-1.0",
    "external_id": "5121",
    "snapshot": "gregobase_20191024"
  },
  "review_status": "needs_review"
}
