{
  "id": "exaudi-deus-904",
  "incipit": "Exaudi Deus",
  "title": "Exaudi Deus",
  "cantus_id": null,
  "genre": "Introitus",
  "genre_code": "in",
  "mode": "V",
  "mode_variant": null,
  "version": "Solesmes",
  "text_latin": "EXáudi Deus * oratiónem meam, et ne despéxeris deprecatiónem meam: inténde in me, et exáudi me. Ps. Contristátus sum in exercitatióne mea: * et conturbátus sum a voce inimíci, et a tribulatióne peccatóris. Glória Patri. E u o u a e.",
  "gabc": "(c3) EX(f)áu(f)di(e) De(f)us(e.) *(,) o(e)ra(d)ti(fh)ó(hvGF)nem(hh) me(hi!jvIH'i)am,(ih..) (;) et(hf~) ne(h) des(i)pé(j)xe(i)ris(h.) (,) de(h)pre(h)ca(h)ti(h)ó(hvGF')nem(f) me(efED'e)am:(ed..) (:) in(f)tén(fe~)de(e!gwh) in(fe~) me,(efED.) (;) et(d!e'f) ex(f_e)áu(f!gw!hvG'FE'gxfw!gvFE)di(de!fvED'e) me.(ed..) <i>Ps.</i>(::) Con(d)tri(f)stá(h)tus(h) sum(h) in(h) ex(h)er(h)ci(h)ta(h)ti(h)ó(h)ne(i) me(i)a:(h.) *(:) et(f) con(h)tur(h)bá(h)tus(h) sum(h) a(h) vo(h)ce(h) i(h)ni(h)mí(h)ci,(h.) (,) et(h) a(h) tri(h)bu(h)la(h)ti(h)ó(h)ne(h) pec(i)ca(g)tó(h)ris.(f.) (::) Gló(d)ri(f)a(h) Pa(h)tri.(h) (::) E(h) u(h) o(i) u(g) a(h) e.(f.) (::)",
  "transcriber": "Andrew Hinkley",
  "commentary": null,
  "liturgical_occurrences": [],
  "bibliography": [
    {
      "title": "Graduale Romanum",
      "editor": "Solesmes",
      "year": 1961,
      "page": "143"
    }
  ],
  "provenance": {
    "origin": "gregobase",
    "license": "CC0-1.0",
    "external_id": "904",
    "snapshot": "gregobase_20191024"
  },
  "review_status": "needs_review"
}
