{
  "id": "insurrexerunt-3890",
  "incipit": "Insurrexerunt",
  "title": "Insurrexerunt",
  "cantus_id": null,
  "genre": "Offertorium",
  "genre_code": "of",
  "mode": "V",
  "mode_variant": null,
  "version": "Vatican",
  "text_latin": "Insurrexérunt * in me viri iníqui: absque misericórdia quaesiérunt me interfícere: et non pepercérunt in fáciem meam spúere: lánceis suis vulneravérunt me, et concússa sunt ómnia ossa mea.",
  "repeat_indication": null,
  "psalm_tone_ending": false,
  "gabc": "(c3) IN(f)SUR(d)RE(fh)XÉ(hiHF)RUNT(ffe) *() in(e) me(egffe) (;) vi(edf)ri(fef) i(e)ní(ef!gwheede)qui:(ed) (:) ab(f)sque(ef) mi(f)se(d)ri(f)cór(hhi~)di(h)a(hh/ijhhfh) (;) quae(hi)si(h)é(ghf)runt(fe) me(edf) in(f)ter(fe)fí(f!gwh)ce(f)re:(de//dfeed) (:) et(fd~) non(efe) pe(f)per(fi)cé(hiHFhhh)runt(h) (,) in(h) fá(gh)ci(h)em(h) me(hjiih)am(hg) spú(hihh)e(f)re:(gxhhh//fgEDe) (:) lán(gxde!fg)ce(f)is(f) su(feede)is(ed) (,) vul(f)ne(h)ra(h)vé(i)runt(hfh) me,(ihhhf//hvFDe) (:) et(d) con(ef~)cús(fef)sa(fi) sunt(hg/hiih) (,) ó(h)mni(h)a(hg/hff) os(fd/ef!ivHGE)sa(fef) me(f/hhvFEDefED)a.(d) (::)",
  "transcriber": "Andrew Hinkley",
  "commentary": null,
  "liturgical_occurrences": [],
  "bibliography": [
    {
      "title": "Graduale Romanum",
      "editor": "Vatican",
      "year": 1908,
      "page": "[82]"
    }
  ],
  "provenance": {
    "origin": "gregobase",
    "license": "CC0-1.0",
    "external_id": "3890",
    "snapshot": "gregobase_20191024"
  },
  "review_status": "needs_review"
}
