{
  "id": "justus-germinabit-6895",
  "incipit": "Justus germinabit",
  "title": "Justus germinabit",
  "cantus_id": null,
  "genre": "Alleluia",
  "genre_code": "al",
  "mode": "I",
  "mode_variant": null,
  "version": "Dominican",
  "text_latin": "Allelúia. ℣. Justus germinábit sicut lílium: et florébit in ætérnum ante Dóminum.",
  "repeat_indication": null,
  "psalm_tone_ending": false,
  "gabc": "(c4) Al(d)le(ffv)lú(gf//ghgh)ia.(hf) (::) (hjHG//hvGFh) (;4) (d!ef//hvGE/fd) (;) (dh//jhhg//hvGFh) (;) (ixhj//kvJIH) (;3) (h!ijIGF//ghFEC) (;) (egFED//ffd) <sp>V/</sp>.(::) Ju(hfh//hvGE/fd)stus(d) (;4) ger(dfddc~)mi(d)ná(dfd;hhggf/ixgig//hi)bit(h) (;) si(d)cut(e!fg) lí(g)li(gfh//hvGE//fd)um:(d) (:) et(f) flo(ghg)ré(h//jvHG//hvGF//gvFD//fvECd;ffd//fvECd;fg/hgh//jvHG//hvGFh;4d!ef//hvGE/fd)bit(d) (;) in(fvEC) æ(egf)tér(ed//ffd)num(d) (::) an(d)te(ff) Dó(gf)mi(fg/hgh)num.(hf) (;) (hghFEC) (;) (egFED//ffd) (::)",
  "transcriber": "Andrew Hinkley",
  "commentary": null,
  "liturgical_occurrences": [],
  "bibliography": [
    {
      "title": "Graduale O.P. (Suarez)",
      "editor": "Dominican",
      "year": 1950,
      "page": "43*"
    }
  ],
  "provenance": {
    "origin": "gregobase",
    "license": "CC0-1.0",
    "external_id": "6895",
    "snapshot": "gregobase_20191024"
  },
  "review_status": "needs_review"
}
