{
  "id": "respice-in-me-4877",
  "incipit": "Respice in me",
  "title": "Respice in me",
  "cantus_id": null,
  "genre": "Offertorium",
  "genre_code": "of",
  "mode": "II",
  "mode_variant": null,
  "version": "Dominican",
  "text_latin": "Réspice in me, et miserére mei: quia tribulatiónes cordis mei multiplicátæ sunt: de necessitátibus meis érue me, Dómine: vide humilitátem meam, et labórem meum.",
  "repeat_indication": null,
  "psalm_tone_ending": false,
  "gabc": "(f3) Ré(c)spi(efef)ce(f//ef/hhg) (::) in(f!ghGFg) me,(gf) (;) et(f) mi(fe/fh)se(h)ré(gf;3hhvFE/fhhv)re(fgef) me(fgf)i:(f) (:) qui(h)a(hhv) tri(f)bu(e)la(f)ti(h)ó(hih)nes(gf) (;4) cor(fe)dis(fe) me(fhGE)i(fe) (;) mul(hhi)ti(h)pli(h)cá(high)tæ(hih) sunt:(h) (:) de(hhv) ne(hg)ces(hhv)si(f)tá(ef/hvGF)ti(fg)bus(f) me(ef)is(fh) (;) é(e)ru(f)e(fih) me,(hg) Dó(h)mi(fgFEf)ne:(fe) (:) vi(fe/fgf)de(fc) (;) hu(efe)mi(f)li(fi)tá(hihhg)tem(f) me(efeev)am,(cbc) (;) et(ef) la(ef)bó(f)rem(fv//hig/hg) me(f!ghGFg)um.(gf) (::)",
  "transcriber": "Andrew Hinkley",
  "commentary": null,
  "liturgical_occurrences": [],
  "bibliography": [
    {
      "title": "Graduale O.P. (Suarez)",
      "editor": "Dominican",
      "year": 1950,
      "page": "103*"
    }
  ],
  "provenance": {
    "origin": "gregobase",
    "license": "CC0-1.0",
    "external_id": "4877",
    "snapshot": "gregobase_20191024"
  },
  "review_status": "needs_review"
}
