{
  "id": "domine-non-secundum-6453",
  "incipit": "Domine, non secundum",
  "title": "Domine, non secundum",
  "cantus_id": null,
  "genre": "Tractus",
  "genre_code": "tr",
  "mode": "II",
  "mode_variant": null,
  "version": "Dominican",
  "text_latin": "Domine, non secúndum peccáta nostra fácias nobis: neque secúndum iniquitátes nostras retríbuas nobis. ℣. Dómine, ne memíneris iniquitátum nostrárum antiquárum: cito antícipent nos misericórdiæ tuæ, quia páuperes facti sumus nimis. ℣. Adjuva nos Deus salutáris noster: et propter glóriam nóminis tui, Dómine, líbera nos: et propítius esto peccátis nostris propter nomen tuum.",
  "repeat_indication": null,
  "psalm_tone_ending": false,
  "gabc": "(f3) Do(f)mi(efEC)ne,(efe//ffe) (;3) (f!ghg//hf//ghg//hf) (::) non(f) se(e)cún(f)dum(efEC) pec(e!fh)cá(h)ta(gf) no(g)stra(fg/hiffe) (;) fá(gh)ci(f)as(f) no(fef//hi)bis:(hg/hiih) (:) ne(e)que(gh) se(f)cún(fg)dum(f) i(f)ni(f)qui(fe)tá(fg)tes(f) no(fef//hi)stras(hg/hiih) (;) re(hg)trí(hiHGE)bu(fgf)as(h) no(hvGF)bis.(fefEC) (;4) (fe/fggf) <sp>V/</sp>.(::) Dó(fhg)mi(hi)ne,(ijIH/ih) (;3) (hhvGE/fe//f!ghGF/gf) (:) ne(fe) me(h)mí(h!ij)ne(jvIHG//hvGFg)ris(gf) (;) i(f)ni(f)qui(hg)tá(h)tum(f) no(f)strá(fg)rum(f) (;) an(f)ti(f)quá(fhhvGFg)rum:(fe//ggf//g!hiffe) (:) ci(e)to(e) an(gh)tí(f)ci(fe)pent(fg) nos(f) (;) mi(f)se(f)ri(fe)cór(fg)di(f)æ(f) tu(fef//hi)æ,(hg/hiih) (:) qui(h)a(h) páu(hihhg)pe(feh)res(h) (;) fa(h)cti(h) su(h)mus(gh/ihi) ni(f)mis.(fggf) <sp>V/</sp>.(::) <alt>Hic genuflect.</alt>() Ad(kxhi/jk)ju(j)va(j) nos(j) De(ji)us(ij) (;) sa(h)lu(hf)tá(h)ris(h!ij) no(jvIHG//hvGFg)ster:(gf) (:) et(f) prop(f)ter(hg) gló(h)ri(f)am(f) nó(fg)mi(f)nis(f) tu(f)i,(fe) Dó(fg)mi(f)ne,(f) (;) lí(fhhvGFg)be(f)ra(fg) nos:(fe//ggf//g!hiffe) (:) et(e) pro(e)pí(gh)ti(f)us(f) e(fg)sto(f) (;) pec(fe)cá(fg)tis(f) no(fef//hi)stris(hgi) (;6) (kxjkiih) (::) prop(hihhg)ter(fe) no(fhf)men(g) (;3) tu(ihiHFg;hjijHGF)um.(fe//fhhv//ijIGh) (;) (gh/jvIG//hvGF/ggf) (::)",
  "transcriber": "Andrew Hinkley",
  "commentary": null,
  "liturgical_occurrences": [],
  "bibliography": [
    {
      "title": "Graduale O.P. (Suarez)",
      "editor": "Dominican",
      "year": 1950,
      "page": "72"
    }
  ],
  "provenance": {
    "origin": "gregobase",
    "license": "CC0-1.0",
    "external_id": "6453",
    "snapshot": "gregobase_20191024"
  },
  "review_status": "needs_review",
  "performance_notes": [
    "Hic genuflect."
  ]
}
