{
  "id": "lux-fulgebit-1665",
  "incipit": "Lux fulgebit",
  "title": "Lux fulgebit",
  "cantus_id": null,
  "genre": "Introitus",
  "genre_code": "in",
  "mode": "VIII",
  "mode_variant": null,
  "version": "Vatican",
  "text_latin": "Lux fulgébit * hódie super nos: quia natus est nobis Dóminus: et vocábitur Admirábilis, Deus, Princeps pacis, Pater futúri saéculi: cujus regni non erit finis. Ps. Dóminus regnávit, decórem indútus est: * indútus est Dóminus fortitúdinem, et praecínxit se. Glória Patri.",
  "repeat_indication": null,
  "psalm_tone_ending": true,
  "gabc": "(c4) LUX(d!fg) ful(gh~)gé(fh/ji)bit(ih) *(,) hó(jjj)di(hg)e(ghGF) su(ixhiHG)per(ghg) nos:(g) (:) qui(j)a(h) na(j)tus(jjj) est(gh) no(h)bis(hfh) Dó(ixhiHG)mi(ghg)nus:(g) (:) et(g) vo(gfh)cá(hg)bi(ghg)tur(g) (,) Ad(g)mi(g)rá(gh/ji)bi(jjj)lis,(gh) (,) De(ixhiHF)us,(f) (;) Prin(f)ceps(g) pa(h)cis,(g) (,) Pa(h)ter(g) fu(f)tú(f!gh)ri(h) saé(hf)cu(ixgih)li:(h) (:) cu(jh~)jus(hkj) re(jjjhh)gni(f) (,) non(gf) e(fh/ji)rit(jvjvIHiw!jvIH) fi(gh!ivHGh)nis.(hg) <i>Ps.</i>(::) Dó(g)mi(hg)nus(gj) re(j)gná(j)vit,(j) de(j)có(ji)rem(jk) in(k)dú(jk)tus(j) est:(j) *(:) in(jh~)dú(hj)tus(j) est(j) Dó(j)mi(j)nus(j) for(j)ti(j)tú(j)di(j)nem,(jji) et(gh) prae(ji)cín(h)xit(h) se.(g) (::) Gló(g)ri(hg)a(gj) Pa(j)tri.(j) (::) E(j) u(jji) o(gh) u(ji) a(h) e.(ghd/ffg) (::)",
  "transcriber": "Andrew Hinkley",
  "commentary": null,
  "liturgical_occurrences": [],
  "bibliography": [
    {
      "title": "Graduale Romanum",
      "editor": "Vatican",
      "year": 1908,
      "page": "28"
    }
  ],
  "provenance": {
    "origin": "gregobase",
    "license": "CC0-1.0",
    "external_id": "1665",
    "snapshot": "gregobase_20191024"
  },
  "review_status": "needs_review"
}
