{
  "id": "induit-eum-3771",
  "incipit": "Induit eum",
  "title": "Induit eum",
  "cantus_id": null,
  "genre": "Tractus",
  "genre_code": "tr",
  "mode": "VIII",
  "mode_variant": null,
  "version": "Vatican",
  "text_latin": "Induit eum * Dóminus vestiméntis salútis, et induménto justítiae, quasi sponsum decorátum coróna. ℣. Coróna tribulatiónis efflóruit in corónam glóriae, et sertum exsultatiónis. ℣. Accépit regnum decóris, diadéma * speciéi.",
  "repeat_indication": null,
  "psalm_tone_ending": false,
  "gabc": "(c4) IN(d)DU(fg)IT(ge/fgDCd) e(fg)um(ixf!iiivHGhhg) *(,) Dó(gjjk)mi(h)nus(gf/ghhg) (;) ve(g)sti(g)mén(hi~)tis(g) sa(hji)lú(jhj)tis,(jjjkhhg/hg/jjh/jggf) (:) et(f) in(hj)du(igh)mén(gf/gh)to(g) ju(gh/jij)stí(j)ti(h!iwj)ae,(jjjvIHivHGhg) (;) qua(hg/h!iwj)si(gf) spon(g)sum(h) de(j)co(hj)rá(jkjjj/kjjh,ji/jjvIG//hjhjvHF//gh!iwjjk)tum(j) (;) co(j)ró(jv//ikjjvjvIGh//jjhjvHFg)na.(g/hhg) <sp>V/</sp>.(::) Co(g)ró(g!hj)na(jjjvIH) tri(j)bu(hg)la(gh)ti(d)ó(ixfffdg//fg/ihivHGh)nis(hg) (;) ef(gh)fló(gh)ru(g)it(g) in(h) co(fg)ró(g!jj/kljjjg,jj/kljjjh//ijHGF//gh!iwjjk)nam(j) (,) gló(j!kl)ri(jh)ae,(hg/hjIG//fh/ji/jkhhg/hg/jjh/jggf) (:) et(g) ser(hg/h!iwj)tum(ghf) ex(f)sul(hj)ta(jj)ti(j)ó(kjjg,jv//kli/jki/jhhg/ixhiGF,iyh/jh/ig)nis.(g/hhg) <sp>V/</sp>.(::) Ac(gd)cé(g)pit(hj) re(jijh)gnum(hg) (,) de(hjh)có(jjjkvJIGhg/h!iw!jvIHijh)ris,(hg) (:) di(g)a(g)dé(hg/h!iwj)ma(ghf) *() spe(f!hj)ci(j)é(i/jhhg/hggfg,jjjkvJIHhg)i.(ghGF) (,) (h!iwjijjh/ihhg) (::)",
  "transcriber": "Andrew Hinkley",
  "commentary": null,
  "liturgical_occurrences": [],
  "bibliography": [
    {
      "title": "Graduale Romanum",
      "editor": "Vatican",
      "year": 1908,
      "page": "[144]"
    }
  ],
  "provenance": {
    "origin": "gregobase",
    "license": "CC0-1.0",
    "external_id": "3771",
    "snapshot": "gregobase_20191024"
  },
  "review_status": "needs_review"
}
