{
  "id": "adjuvabit-eam-1373",
  "incipit": "Adjuvabit eam",
  "title": "Adjuvabit eam",
  "cantus_id": null,
  "genre": "Graduale",
  "genre_code": "gr",
  "mode": "V",
  "mode_variant": null,
  "version": "Solesmes",
  "text_latin": "Adjúvabit * eam Deus vultu suo: Deus in médio ejus, non commovébitur. ℣. Flúminis ímpetus laetíficat civitátem Dei: sanctificávit tabernáculum, suum * Altíssimus.",
  "repeat_indication": null,
  "psalm_tone_ending": false,
  "gabc": "(c3) AD(d)jú(fh)va(hv.hh//hhh)bit(f.) *(,) e(fhgh)am(g) De(fhG'E)us(ef//e!hhhf/hff/ded.) (;) vul(f_d/ef!gwh/ih~)tu(hi/kkh/ihh/fgf.) (,) su(hhgh/ihhg/h'/ihhg/h'/ihhggfg)o:(gf..) (:) De(fh/ih)us(hg/ijIH.ghGF.) (,) in(fh) mé(hh//fh/ihi)di(ig/hf)o(f) e(gxfv.ef!hvFEfhF'ED'ewf!gvFE)jus,(fe..) (:) non(df//eh/ih) com(hhh)mo(fhg)vé(hhhf//hef)bi(de)tur.(d!ef!hv.ijHF.) (,) (gxhhvF'EfgED'ewfe/fhff/ded.) <sp>V/</sp>.(::) Flú(hh/ihh'hh//ihh'hh_f/hv.ijIH./jlihvGE/fv.hfh./ghF'D/e_d/e_d , df!hv.ijh)mi(igh)nis(h.) ím(ih/i!kkh/ihi)pe(i)tus(ji/hh/fgf.) (;) lae(f)tí(hi/k.i!jw!kl)fi(lkkvJ'IH)cat(iih.) (,) ci(f)vi(h)tá(hhhvGE'/f!hhgxihhvG'FE/fg)tem(f.) (,) De(gxgg//gghvG'FE'/fw!gvF'ED'e)i:(ed..) (:) sanc(f)ti(d)fi(fh)cá(hv.fh/iih/ii,fh/i!kkkh klkkvI'Hh'hf/hhhi)vit(h.) (;) ta(h)ber(h)ná(hiH'GE,ffe/ff//eh/ihi)cu(ig/hf)lum,(f.) (`) su(fhF'E)um(f!hhhf//hhhvGF'heed.) *(;) Al(d!e'f~)tís(fhGF')si(i)mus.(hhf.) (,) (gxg_fgvED.fgED.fehv.hhhff//dfe/feed.) (::)",
  "transcriber": "Andrew Hinkley",
  "commentary": null,
  "liturgical_occurrences": [],
  "bibliography": [
    {
      "title": "Graduale Romanum",
      "editor": "Solesmes",
      "year": 1961,
      "page": "[56]"
    }
  ],
  "provenance": {
    "origin": "gregobase",
    "license": "CC0-1.0",
    "external_id": "1373",
    "snapshot": "gregobase_20191024"
  },
  "review_status": "needs_review"
}
