{
  "id": "desiderium-3815",
  "incipit": "Desiderium",
  "title": "Desiderium",
  "cantus_id": null,
  "genre": "Tractus",
  "genre_code": "tr",
  "mode": "VIII",
  "mode_variant": null,
  "version": "Vatican",
  "text_latin": "Desidérium * ánimae ejus tribuísti ei: et voluntáte labiórum ejus non fraudásti eum ℣. Quóniam praevenísti eum in benedictióne dulcédinis ℣. Posuísti super caput ejus corónam de lápide * pretióso.",
  "repeat_indication": null,
  "psalm_tone_ending": false,
  "gabc": "(c4) DE(f)SI(f)DÉ(fg!hvhg)RI(hggf)UM(fg!hvhg/hvGFgf) *(;) á(gjjk)ni(h)mae(hg/hf//hjhj) e(jvIH/iw!jvIHGh)jus(hg) (;) tri(ghg)bu(fg)í(jj)sti(hji) e(j)i:(jjjkhhg/hg/jjjh/jggf) (:) et(f) vo(f)lun(f)tá(hj)te(igh) la(gf/gh)bi(g)ó(g)rum(gh/jij) e(jh!iwj)jus(jjjvIHivHGhg) (;) non(hg/h!iwj) frau(gf~)dá(g)sti(h) e(j/kjjg//j/kjjjj/kjjh,ji/jjvIG//hjh/jvHF,gh!jvvIG//hjHFg)um(g/hhg) <sp>V/</sp>.(::) Quó(g)ni(g)am(gd) prae(g)ve(hih)ní(jjji)sti(g) e(hg/h!iw!jvIHijh)um(hg) (:) in(g) be(ghg)ne(fg)di(jj)cti(hji)ó(j)ne(jkjjj/kjjh) (,) (ji/jjvIG//hjh/jvHF//gh!iwjjv) (;) dul(jk~)cé(jv//ikjjvjvIGh//jjh/jvHG)di(fg)nis(g/hhg) <sp>V/</sp>.(::) Po(g)su(g)í(g!hj)sti(jjjvIH) su(jhhg)per(gh) ca(h/jjh)put(gf) e(ghg~)jus(hg) (,) (ixih/ivGF//g/hg/hg/hg/jjh/jggf) (:) co(gh/jij)ró(jh!iwj)nam(jjjvIH/ivHGhg) (;) de(g) lá(hg/h!iwj)pi(ghGF)de(f) *(,) pre(f!hj)ti(j)ó(i/jhhg/hggfg,jjj/kvJIHhg)so.(ghGF) (,) (h!iwjijjh/ihhg) (::)",
  "transcriber": "Andrew Hinkley",
  "commentary": null,
  "liturgical_occurrences": [],
  "bibliography": [
    {
      "title": "Graduale Romanum",
      "editor": "Vatican",
      "year": 1908,
      "page": "[4]"
    }
  ],
  "provenance": {
    "origin": "gregobase",
    "license": "CC0-1.0",
    "external_id": "3815",
    "snapshot": "gregobase_20191024"
  },
  "review_status": "needs_review"
}
